{
  "name": "document_1",
  "language": "en",
  "annotations": [
    {
      "id": "0",
      "key": "Group1",
      "values": [
        {
          "value": "",
          "children": [
            {
              "id": "1",
              "key": "name",
              "values": [
                {
                  "value": "John"
                }
              ]
            },
            {
              "id": "2",
              "key": "surname",
              "values": [
                {
                  "value": "Smith",
                  "value_variants": [
                    "Smith",
                    "smith",
                    "SMITH"
                  ]
                }
              ]
            }
          ]
        },
        {
          "value": "",
          "children": [
            {
              "id": "3",
              "key": "name",
              "values": [
                {
                  "value": "Mary"
                }
              ]
            },
            {
              "id": "4",
              "key": "surname",
              "values": [
                {
                  "value": "Jones",
                  "value_variants": [
                    "Jones",
                    "jones",
                    "JONES"
                  ]
                }
              ]
            }
          ]
        }
      ]
    },
    {
      "id": "5",
      "key": "Group2",
      "values": [
        {
          "value": "",
          "children": [
            {
              "id": "6",
              "key": "name",
              "values": [
                {
                  "value": "Kate"
                }
              ]
            },
            {
              "id": "7",
              "key": "surname",
              "values": [
                {
                  "value": "Taylor",
                  "value_variants": [
                    "Taylor",
                    "taylor",
                    "TAYLOR"
                  ]
                }
              ]
            }
          ]
        },
        {
          "value": "",
          "children": [
            {
              "id": "8",
              "key": "name",
              "values": [
                {
                  "value": "Alex"
                }
              ]
            },
            {
              "id": "9",
              "key": "surname",
              "values": [
                {
                  "value": "Armstrong",
                  "value_variants": [
                    "Armstrong",
                    "armstrong",
                    "ARMSTRONG"
                  ]
                }
              ]
            }
          ]
        }
      ]
    }
  ],
  "split": "dev"
}